{
  "schema_version": "cpu-prefetch-stage17-read-only-preflight-fixed-action-plan/5",
  "plan_id": "STAGE17-READ-ONLY-PREFLIGHT-FIXED-ACTION-PLAN-v5",
  "protocol_version": "2.0.0-pre.2",
  "predecessor": {
    "path": "config/stage17/stage17-read-only-preflight-fixed-action-plan-v4.json",
    "size_bytes": 9678,
    "sha256": "bca103107c5deaed6797ea4e595d53f3e42639c36609ede0433b7cfbd3c528c4"
  },
  "owner_command_bytes_allowed": false,
  "fixed_environment": {"LANG": "C", "LC_ALL": "C", "TZ": "UTC0"},
  "transport": {
    "local_executable_role": "STAGE17_READ_ONLY_PREFLIGHT_EXECUTOR_v5",
    "local_shell": false,
    "ssh_executable": "/usr/bin/ssh",
    "remote_command": "/usr/bin/env -i LANG=C LC_ALL=C TZ=UTC0 /usr/bin/python3 -I -S -",
    "remote_executable": "/usr/bin/env",
    "remote_argv": ["-i", "LANG=C", "LC_ALL=C", "TZ=UTC0", "/usr/bin/python3", "-I", "-S", "-"],
    "remote_login_shell_boundary": "FIXED_TOKEN_STRING_NO_OWNER_COMMAND_BYTES_ACCEPTED_BY_D-100",
    "fixed_ssh_argv_template": [
      "/usr/bin/ssh", "-F", "/dev/null", "-T",
      "-o", "BatchMode=yes", "-o", "StrictHostKeyChecking=yes",
      "-o", "UserKnownHostsFile={PARENT_PROCFD_KNOWN_HOSTS_LOCATOR}",
      "-o", "GlobalKnownHostsFile=/dev/null", "-o", "HostKeyAlgorithms=ssh-ed25519",
      "-o", "UpdateHostKeys=no", "-o", "PubkeyAuthentication=yes",
      "-o", "PasswordAuthentication=no", "-o", "KbdInteractiveAuthentication=no",
      "-o", "PreferredAuthentications=publickey", "-o", "IdentitiesOnly=yes",
      "-o", "IdentityFile={PARENT_PROCFD_TRANSPORT_IDENTITY_LOCATOR}",
      "-o", "IdentityAgent=none", "-o", "ConnectionAttempts=1",
      "-o", "ConnectTimeout=10", "-o", "ServerAliveInterval=5",
      "-o", "ServerAliveCountMax=1", "-o", "ClearAllForwardings=yes",
      "-o", "ExitOnForwardFailure=yes", "-o", "ControlMaster=no",
      "-o", "ControlPath=none", "-o", "PermitLocalCommand=no",
      "-o", "RequestTTY=no", "-o", "LogLevel=ERROR", "--", "{SSH_TARGET}",
      "/usr/bin/env -i LANG=C LC_ALL=C TZ=UTC0 /usr/bin/python3 -I -S -"
    ],
    "option_path_policy": "SEALED_MEMFD_LIVE_PARENT_PROCFS_NO_OWNER_PATH_AFTER_MARKER",
    "pass_fds_required": false,
    "credential_descriptor_inheritance_forbidden": true,
    "attempts_per_observation": 1,
    "retries": 0,
    "stop_on_first_failure": true,
    "per_observation_timeout_seconds": 30,
    "global_monotonic_deadline_seconds": 180
  },
  "authority_transport_boundary": {
    "snapshot_reverification_before_final_guard": true,
    "final_system_utc_inside_transport_boundary": true,
    "popen_is_next_operation_after_guard": true,
    "system_utc_live_and_nondecreasing_required": true,
    "monotonic_authority_deadline_required": true,
    "global_deadline_and_cleanup_reserve_required": true,
    "guard_required_before_every_transport": true
  },
  "ssh_child_lifecycle": {
    "start_new_session": true,
    "single_transport_owner": true,
    "terminate_process_group_on_every_exception_timeout_or_cancellation": true,
    "bounded_sigterm_then_sigkill": true,
    "reap_before_snapshot_close": true,
    "reap_before_failure_or_receipt": true,
    "cleanup_charged_to_global_monotonic_deadline": true,
    "final_reap_barrier_overrides_return_on_budget_exhaustion": true,
    "cleanup_exception_cannot_hide_primary_failure": true,
    "pid_or_private_bytes_in_evidence": false
  },
  "openssh_input_pinning": {
    "mechanism": "LINUX_SEALED_MEMFD_PARENT_PROCFS-v1",
    "procfs_visible_pid_source": "NUMERIC_READLINK_OF_PROC_SELF",
    "os_getpid_as_procfs_pid_allowed": false,
    "source_open_flags": ["O_RDONLY", "O_NOFOLLOW", "O_CLOEXEC"],
    "memfd_flags": ["MFD_ALLOW_SEALING", "MFD_CLOEXEC"],
    "snapshot_mode_octal": "0600",
    "required_seals": ["F_SEAL_WRITE", "F_SEAL_GROW", "F_SEAL_SHRINK", "F_SEAL_SEAL"],
    "known_hosts_snapshot_required": true,
    "transport_identity_snapshot_required": true,
    "parent_holds_descriptors_until_ssh_exit": true,
    "child_inherits_credential_descriptors": false,
    "procfs_locator_reopen_identity_size_seals_hash_required": true,
    "source_path_reuse_after_marker": false,
    "private_key_bytes_in_logs_or_evidence": false,
    "pinning_or_procfs_failure_before_marker": true
  },
  "local_openssh_consumption_capability": {
    "required_before_final_authority_sample": true,
    "real_ssh_executable": "/usr/bin/ssh",
    "real_sshd_executable": "/usr/sbin/sshd",
    "real_ssh_keygen_executable": "/usr/bin/ssh-keygen",
    "transport": "LOCAL_PROXYCOMMAND_PIPE_NO_SOCKET_NO_NETWORK",
    "disposable_synthetic_ed25519_host_and_client_keys": true,
    "source_mutation_after_snapshot_before_consumption": true,
    "strict_host_key_verification_required": true,
    "public_key_authentication_required": true,
    "owner_identity_parseability_required": true,
    "private_bytes_recorded": false,
    "failure_before_marker": true
  },
  "authority_clock_boundary": {
    "authorization_timestamp_format": "EXACT_SECOND_UTC_Z",
    "actual_timestamp_format": "FULL_PRECISION_SYSTEM_UTC_Z",
    "all_long_checks_before_final_sample": true,
    "final_sample_immediately_before_marker": true,
    "second_sample_after_durable_marker_before_first_transport": true,
    "reject_expired_not_yet_valid_or_rollback": true,
    "post_marker_rejection_creates_typed_failure": true
  },
  "evidence_root_policy": {
    "owner_supplies_one_normalized_absolute_root": true,
    "root_must_preexist_as_owner_owned_nonsymlink_directory": true,
    "group_or_other_write_forbidden": true,
    "repository_descendants_forbidden": true,
    "forbidden_absolute_roots": ["/etc", "/proc", "/sys"],
    "parent_traversal_forbidden": true,
    "symlink_components_forbidden": true,
    "directory_fd_flags": ["O_DIRECTORY", "O_NOFOLLOW", "O_CLOEXEC"],
    "child_create_flags": ["O_CREAT", "O_EXCL", "O_NOFOLLOW", "O_CLOEXEC"],
    "marker_file_fsync_before_transport": true,
    "parent_directory_fsync_before_transport": true,
    "attempt_marker_relative_path": "stage17-read-only-preflight-attempt-v5.json",
    "failure_relative_path": "stage17-read-only-preflight-failure-v5.json",
    "completion_relative_path": "stage17-read-only-preflight-completion-v4.json",
    "observation_stdout_template": "s17-ro-{ORDINAL_3_DIGIT}.stdout.bin",
    "observation_stderr_template": "s17-ro-{ORDINAL_3_DIGIT}.stderr.bin",
    "observation_receipt_template": "s17-ro-{ORDINAL_3_DIGIT}.receipt-v4.json"
  },
  "typed_owner_values": [
    "stand_id", "ssh_target", "known_hosts_host", "pinned_host_key_evidence_binding",
    "pinned_known_hosts_binding", "transport_identity_locator_size_sha256",
    "pilot_archive_locator", "pilot_sidecar_locator", "extracted_bundle_root_locator",
    "capture_id", "captured_at_utc", "evidence_root", "authorization_id", "actor",
    "issued_at_utc", "expires_at_utc"
  ],
  "observations": [
    {"ordinal": 1, "observation_id": "S17-RO-PREFLIGHT-001-TARGET-AND-TRANSPORT-IDENTITY", "stdin_binding": "STAGE17_READ_ONLY_PREFLIGHT_COLLECTOR_v2_RENDER_TARGET_IDENTITY", "output_type": "CANONICAL_JSON_STDOUT_PLUS_RAW_STDERR_AND_TYPED_RECEIPT", "max_output_bytes": 1048576, "timeout_seconds": 30, "read_only_effect": "OBSERVE_HOSTNAME_KERNEL_MACHINE_AND_REMOTE_PYTHON_PATH"},
    {"ordinal": 2, "observation_id": "S17-RO-PREFLIGHT-002-ARCHIVE-AND-SIDECAR-BYTE-VERIFICATION", "stdin_binding": "STAGE17_READ_ONLY_PREFLIGHT_COLLECTOR_v2_RENDER_ARCHIVE_VERIFICATION", "output_type": "CANONICAL_JSON_STDOUT_PLUS_RAW_STDERR_AND_TYPED_RECEIPT", "max_output_bytes": 1048576, "timeout_seconds": 30, "read_only_effect": "READ_AND_HASH_EXACT_ARCHIVE_AND_SIDECAR"},
    {"ordinal": 3, "observation_id": "S17-RO-PREFLIGHT-003-BUNDLE-INTERNAL-VERIFICATION", "stdin_binding": "STAGE17_READ_ONLY_PREFLIGHT_COLLECTOR_v2_RENDER_INTERNAL_VERIFICATION", "output_type": "CANONICAL_JSON_STDOUT_PLUS_RAW_STDERR_AND_TYPED_RECEIPT", "max_output_bytes": 1048576, "timeout_seconds": 30, "read_only_effect": "READ_AND_HASH_BUNDLE_MANIFEST_AND_SHA256SUMS_MEMBERS"},
    {"ordinal": 4, "observation_id": "S17-RO-PREFLIGHT-004-NONPRIVILEGED-SELF-TESTS", "stdin_binding": "STAGE17_READ_ONLY_PREFLIGHT_COLLECTOR_v2_RENDER_SELF_TESTS", "output_type": "CANONICAL_JSON_STDOUT_PLUS_RAW_STDERR_AND_TYPED_RECEIPT", "max_output_bytes": 1048576, "timeout_seconds": 30, "read_only_effect": "RUN_FIXED_SMOKE_PREFLIGHT_AND_QUALIFICATION_SELF_TEST_ARGV_WITH_SHELL_FALSE"},
    {"ordinal": 5, "observation_id": "S17-RO-PREFLIGHT-005-RUNTIME-TOOL-IDENTITIES", "stdin_binding": "STAGE17_READ_ONLY_PREFLIGHT_COLLECTOR_v2_RENDER_RUNTIME_IDENTITIES", "output_type": "CANONICAL_JSON_STDOUT_PLUS_RAW_STDERR_AND_TYPED_RECEIPT", "max_output_bytes": 1048576, "timeout_seconds": 30, "read_only_effect": "LSTAT_AND_HASH_FIXED_REMOTE_RUNTIME_AND_BUNDLE_EXECUTABLES"},
    {"ordinal": 6, "observation_id": "S17-RO-PREFLIGHT-006-READ-ONLY-PLATFORM-INVENTORY", "stdin_binding": "STAGE17_READ_ONLY_PREFLIGHT_COLLECTOR_v2_RENDER_PLATFORM_INVENTORY", "output_type": "CANONICAL_JSON_STDOUT_PLUS_RAW_STDERR_AND_TYPED_RECEIPT", "max_output_bytes": 1048576, "timeout_seconds": 30, "read_only_effect": "RUN_FIXED_PREFLIGHT_INVENTORY_ARGV_WITH_SHELL_FALSE"}
  ],
  "record_formats": {
    "attempt": "cpu-prefetch-stage17-read-only-preflight-attempt/5",
    "observation_receipt": "cpu-prefetch-stage17-read-only-preflight-observation-receipt/4",
    "failure": "cpu-prefetch-stage17-read-only-preflight-failure/5",
    "completion": "cpu-prefetch-stage17-read-only-preflight-completion/4"
  },
  "forbidden_semantics": {
    "caller_controlled_execution_time": true,
    "stale_authority_sample_across_final_preparation": true,
    "snapshot_verification_after_final_authority_guard": true,
    "transport_without_live_monotonic_authority_deadline": true,
    "transport_before_post_marker_authority_sample": true,
    "clock_rollback": true,
    "mutable_openssh_source_path_after_validation": true,
    "openssh_self_procfd_with_pass_fds": true,